id,text,label,source,platform_type,language,date_collected
UG_TRUE_709,Government eggye amasinzizo n’ebitongole by’obwannakyewa – ku lukalala lw’ebifo ebiyinza okukusibwamu ensimbi ezivujjirira obutujju,TRUE,CBS FM,traditional_media,Luganda,2026-02-19
UG_TRUE_710,Ebyava mu bigezo bya PLE 2024 bifulumye – abayizi abafuna D1 bakendedde,TRUE,CBS FM,traditional_media,Luganda,2026-02-19
UG_TRUE_711,Abantu 2 bafiiriddewo mbulaga mu kabenje akagudde e Nakasongola –  12 baddusiddwa mu malwaliro,TRUE,CBS FM,traditional_media,Luganda,2026-02-19
UG_TRUE_712,Dr.Kiiza Besigye akkiriziddwa okuddamu okumutwalira emmere okuva ebweru w’ekkomera,TRUE,CBS FM,traditional_media,Luganda,2026-02-19
UG_TRUE_713,"Ebyava mu bigezo by’abayizi abaatuula PLE 2024 bifuluma ku Thursday nga 23 January,2025",TRUE,CBS FM,traditional_media,Luganda,2026-02-19
UG_TRUE_714,Donald Trump alayiziddwa nga president wa America owa 47 – asuubizza okubeera muzzanganda,TRUE,CBS FM,traditional_media,Luganda,2026-02-19
UG_TRUE_715,Embeera ya Dr.Kiiza Besigye mu kkomera yeraliikirizza bannamateeka be,TRUE,CBS FM,traditional_media,Luganda,2026-02-19
UG_TRUE_716,Electoral Commission etandise okutimba enkalala z’abanaalonda mu 2026 – atali ku lukalala takkirizibwa kwenyigira mu nsonga za byakulonda wadde okuloopa omusango,TRUE,CBS FM,traditional_media,Luganda,2026-02-19
UG_TRUE_717,Abagambibwa okulya eza PDM mu Wakiso – 3 bakwatiddwa,TRUE,CBS FM,traditional_media,Luganda,2026-02-19
UG_TRUE_718,Amalwaliro ga government gatubidde n’ebyuma ebitakozesebwa – abakugu ababikolako tebalabika,TRUE,CBS FM,traditional_media,Luganda,2026-02-19
UG_TRUE_719,Okuliyirira abantu abaakosebwa kasasiro w’e Kiteezi kulinze alipoota ya Ssaababalirizi w’ebitabo bya government,TRUE,CBS FM,traditional_media,Luganda,2026-02-19
UG_TRUE_720,Dp etandise enteekateeka ezikyusa obukulembeze bwayo,TRUE,CBS FM,traditional_media,Luganda,2026-02-19
UG_TRUE_721,Ekyuma ekiteeberezebwa okubeera bbomu kisse abatunda scrap e Buikwe,TRUE,CBS FM,traditional_media,Luganda,2026-02-19
UG_TRUE_722,Captain Denis Olaa agattiddwa ku misango gy’emmundu egivunaanibwa Dr.Besigye ne Obed Kamulegeya,TRUE,CBS FM,traditional_media,Luganda,2026-02-19
UG_TRUE_723,Ssegiriinya Muhammad aziikiddwa – ab’oLuganda bakukkulumye obutaweebwa mukisa kukungubagira muntu wabwe,TRUE,CBS FM,traditional_media,Luganda,2026-02-19
UG_TRUE_724,Abakulembeze ba Africa bakungaanidde mu Uganda okukubaganya ebirowoozo ku kwongera obungi bw’emmere mu mawanga gabwe – essira liteekeddwa ku ttaka n’obungi bw’abavubuka,TRUE,CBS FM,traditional_media,Luganda,2026-02-19
UG_TRUE_725,Emirambo 2 gisuuliddwa e Nakasongola – kuliko ogw’omukazi n’omusajja,TRUE,CBS FM,traditional_media,Luganda,2026-02-19
UG_TRUE_726,"Buli mubaka wa parliament wakuwaayo emitwalo 300,000/=  – okudduukirira family ya Ssegiriinya Muhammad",TRUE,CBS FM,traditional_media,Luganda,2026-02-19
UG_TRUE_727,Kooti eragidde eyali minister Agnes Nandutu yennyonyoleko ku by’okwekomya amabaati g’abantu br Kalamoja,TRUE,CBS FM,traditional_media,Luganda,2026-02-19
UG_TRUE_728,Parliament etudde okukungubagira Ssegiriinya Muhammad abadde omubaka wa Kawempe North – Ababaka babadde ba muswaba,TRUE,CBS FM,traditional_media,Luganda,2026-02-19
UG_TRUE_729,Ebikumi nébikumi by’abakungubazi byeyiye ku kitebe kya NUP – okukungubagira Omubaka Muhammad Ssegiriinya,TRUE,CBS FM,traditional_media,Luganda,2026-02-19
UG_TRUE_730,"Omubaka Ssegiriinya Muhammad aziikibwa ku Sunday nga 12 January,2025",TRUE,CBS FM,traditional_media,Luganda,2026-02-19
UG_TRUE_731,Eddwaliro ly’e Lubaga mu butongole likakasizza nti Omubaka Ssegiriinya Muhammad afudde!,TRUE,CBS FM,traditional_media,Luganda,2026-02-19
UG_TRUE_732,Kitalo! Omubaka Muhammad Ssegiriinya – 1988 -2025,TRUE,CBS FM,traditional_media,Luganda,2026-02-19
UG_TRUE_733,Katikkiro Mayiga asabye bannaddiini okusabira abakulembeze mu Uganda abaweddemu obuntu bulamu – abadde ku mukolo gw’Ababiikira e Bwanda,TRUE,CBS FM,traditional_media,Luganda,2026-02-19
UG_TRUE_734,Abakulembeze be Wakiso batabuse olwa kasasiro aggyibwa mu Kampala – yandiviirako endwadde okubalukawo,TRUE,CBS FM,traditional_media,Luganda,2026-02-19
UG_TRUE_735,Police ekutte 9 abagambibwa okunyagulira abantu e Mityana ne Kassanda,TRUE,CBS FM,traditional_media,Luganda,2026-02-19
UG_TRUE_736,Uganda Law Society etaddewo ekibinja kya bannamateeka okwekenneenya emisango egivunaanibwa Dr.Kiiza Besigye mu kooti y’amagye,TRUE,CBS FM,traditional_media,Luganda,2026-02-19
UG_TRUE_737,"Dr.Kiiza Besigye ne Obed Kamulegeya bazziddwayo ku alimanda – baakudda mu kooti nga 13 January,2025",TRUE,CBS FM,traditional_media,Luganda,2026-02-19
UG_TRUE_738,Munnamateeka Eron Kiiza asaliddwa ekibonerezo ky’akusibwa emyezi 9 – asingisiddwa omusango gw’okuvvoola kooti y’amagye,TRUE,CBS FM,traditional_media,Luganda,2026-02-19
UG_TRUE_739,Martha Wangari Karua akwasiddwa ebbaluwa emukkiriza okuwolereza Dr.Kiiza Besigye,TRUE,CBS FM,traditional_media,Luganda,2026-02-19
UG_TRUE_740,Uganda Electoral Commission esobeddwa ku by’ennoongosereza zebaasindika mu parliament – zikyalemeddwa okwanjulwa wadde akalulu ka 2026 kasembe,TRUE,CBS FM,traditional_media,Luganda,2026-02-19
UG_TRUE_741,Omusibe omu yattiddwa ng’atoloka mu kkomera e Fortportal – abalala 4 bakwatiddwa mu makomera agenjawulo,TRUE,CBS FM,traditional_media,Luganda,2026-02-19
UG_TRUE_742,Government ereeta ennoongosereza mu tteeka ly’ettaka – ppolojekiti zaayo zibadde zisusse okuzingama,TRUE,CBS FM,traditional_media,Luganda,2026-02-19
UG_TRUE_743,Kyaddaaki Uganda Law Council ekkirizza Martha Karua okuwolereza Dr.Kiiza Besigye,TRUE,CBS FM,traditional_media,Luganda,2026-02-19
UG_TRUE_744,Prof.Vincent Kakembo atuuziddwa nga Vice chancellor wa Muteesa I Royal University – ku matikkira ag’omulundi ogwe 12,TRUE,CBS FM,traditional_media,Luganda,2026-02-19
UG_TRUE_745,Okusereba kw’omwana omulenzi kuteeka Uganda mu Katyabaga – Ssaabalabirizi Kazimba Mugalu,TRUE,CBS FM,traditional_media,Luganda,2026-02-19
UG_TRUE_746,Ssaabasumba Kasujja alabudde bannaddiini abavudde ku kigambo kya Katonda – nebeemalira mu by’obufuzi ebyawulayawula mu bantu,TRUE,CBS FM,traditional_media,Luganda,2026-02-19
UG_TRUE_747,Abayisiraamu baweereddwa amagezi okwetegekera akalulu ka 2026 – besimbewo ku buli kifo,TRUE,CBS FM,traditional_media,Luganda,2026-02-19
UG_TRUE_748,Ebyava mu kubala abantu mu Uganda 2024 –  bannauganda abasoba mu kakasse kalamba n’ekitundu tebalina webabeera,TRUE,CBS FM,traditional_media,Luganda,2026-02-19
UG_TRUE_749,Omuliro gusaanyizaawo ebintu by’abatuuze ku kyalo kiramba mu district ye Nabiratuk,TRUE,CBS FM,traditional_media,Luganda,2026-02-19
UG_TRUE_750,Ssaabasajja Kabaka aggaddewo omwaka omukadde 2024 – naggulawo omuggya 2025,TRUE,CBS FM,traditional_media,Luganda,2026-02-19
UG_TRUE_751,"Bannauganda abali mu UAE nga tebalina biwandiiko bali mu kattu – nsalesale eyabaweebwa agwako 31 December,2024",TRUE,CBS FM,traditional_media,Luganda,2026-02-19
UG_TRUE_752,Okukuza olunaku lw’amaka amalungi – abafumbo balabuddwa ku nneyisa zaabwe ezitamya abavubuka obufumbo,TRUE,CBS FM,traditional_media,Luganda,2026-02-19
UG_TRUE_753,Omumyuka w’omubaka wa president e Budaka afiiridde mu kabenje e Mayuge,TRUE,CBS FM,traditional_media,Luganda,2026-02-19
UG_TRUE_754,Ekanisa ya Uganda ekuzizza olunaku lw’abaana abattibwa obwereere – essira liteekeddwa kukuwa abaana essuubi,TRUE,CBS FM,traditional_media,Luganda,2026-02-19
UG_TRUE_755,Oluguudo lwa Nothern Bypass lutandise okuddaabirizibwa –  lwakumala emyezi 6,TRUE,CBS FM,traditional_media,Luganda,2026-02-19
UG_TRUE_756,"Government ya Uganda erangiridde olwa nga 6 January,2025 – okutandika okussa number plate endigito ku mmotoka z’obwannanyini",TRUE,CBS FM,traditional_media,Luganda,2026-02-19
UG_TRUE_757,Hajjat Sharifah Buzeki alondeddwa nga Ssenkulu wa KCCA omuggya –  Benon Kigenyi ye mumyuka,TRUE,CBS FM,traditional_media,Luganda,2026-02-19
UG_TRUE_758,Okukuuma emirembe n’okuzzaamu abantu essuubi – z’empagi ezisiinze okussibwako essira mu kukuza olunaku lwa Ssekukkulu 2024,TRUE,CBS FM,traditional_media,Luganda,2026-02-19
UG_TRUE_759,Obubaka bwa Ssaabasajja Kabaka obwa Ssekukkulu 2024 – alagidde abantu be okwongera okulima emmwanyi mu bungi,TRUE,CBS FM,traditional_media,Luganda,2026-02-19
UG_TRUE_760,Abantu 4 bafiiridde mu kabenje akagudde e Nakasongola  – Taxi etomedde lukululana,TRUE,CBS FM,traditional_media,Luganda,2026-02-19
UG_TRUE_761,Eng.Daniel Ssebuggwawo bba wa minister Owek.Joyce Ssebuggwawo –  aziikiddwa e Nkumba ku lunaku lwennyini lweyazaalibwako,TRUE,CBS FM,traditional_media,Luganda,2026-02-19
UG_TRUE_762,Omusirikale akubye omuntu wa bulijjo amasasi agamuttiddewo mu Kampala – police emuyigga,TRUE,CBS FM,traditional_media,Luganda,2026-02-19
UG_TRUE_763,FDC Katonga etwalidde Dr.Kiiza Besigye ebyassava bya Ssekukkulu 2024,TRUE,CBS FM,traditional_media,Luganda,2026-02-19
UG_TRUE_764,Emyaka 50 egy’obusumba bwe Bunnamwaya – Ssaabalabirizi atabukidde abalemesa enkulaakulana y’ekkanisa,TRUE,CBS FM,traditional_media,Luganda,2026-02-19
UG_TRUE_765,Ssentebe wa Wakiso alabudde ab’ebyokwerinda abakozesa abakozi okubega banabwe – obunkenke buzingamya emirimu,TRUE,CBS FM,traditional_media,Luganda,2026-02-19
UG_TRUE_766,Owek.Nelson Kawalya eyaliko sipiika wa Buganda – aziikiddwa e Buyuki mu Bulemeezi,TRUE,CBS FM,traditional_media,Luganda,2026-02-19
UG_TRUE_767,Kitalo! – ekya Eng. Daniel Ssebuggwawo bba wa Owek. Joyce Juliet Ssebuggwawo ,TRUE,CBS FM,traditional_media,Luganda,2026-02-19
UG_TRUE_768,Olutindo lw’e Kaluma luzzeemu okukola oluvannyuma lw’emyezi esatu nga luddaabirizibwa,TRUE,CBS FM,traditional_media,Luganda,2026-02-19
UG_TRUE_769,Government eyanjulidde parliament etteeka eppya erifuga eggye ly’eggwanga – SFC etongozebwe mu mateeka,TRUE,CBS FM,traditional_media,Luganda,2026-02-19
UG_TRUE_770,Emmotoka ne business eziwera zisaanyiziddwawo omuliro e Wandegeya ku bbiri,TRUE,CBS FM,traditional_media,Luganda,2026-02-19
UG_TRUE_771,President Museveni atadde omukono ku mabago g’amateeka 9 – ery’emmwanyi eriggyawo UCDA likyajulidde,TRUE,CBS FM,traditional_media,Luganda,2026-02-19
UG_TRUE_772,Owek.Nelson Kawalya eyali omukubiriza w’Olukiiko lwa Buganda afudde!,TRUE,CBS FM,traditional_media,Luganda,2026-02-19
UG_TRUE_773,Parliament etandise okunoonyereza ku sente obuwumbi obusoba mu 68 ezaabulankanyizibwa mu bank enkulu eya Uganda,TRUE,CBS FM,traditional_media,Luganda,2026-02-19
UG_TRUE_774,Abantu 3 ababadde basaabalira ku pikipiki batomeddwa mmotoka e Kamuli,TRUE,CBS FM,traditional_media,Luganda,2026-02-19
UG_TRUE_775,"Amakomera gonna mu Uganda gaweze okukyalira abasibe okutuusa nga 18 January,2025",TRUE,CBS FM,traditional_media,Luganda,2026-02-19
UG_TRUE_776,Democratic Alliance siyakutaliza kibiina kyonna – Mathias Mpuuga,TRUE,CBS FM,traditional_media,Luganda,2026-02-19
UG_TRUE_777,"Bannauganda abaagenze e Singapore okubangulwa ku kulwanyisa enguzi tebalina kyanjawulo kyebagenda kukyusa, amateeka gegasinga – Anti corruption Coalition Uganda",TRUE,CBS FM,traditional_media,Luganda,2026-02-19
UG_TRUE_778,Enteeseganya wakati wa Rwanda ne DRC zigudde butaka – president Kagame azeesambye,TRUE,CBS FM,traditional_media,Luganda,2026-02-19
UG_TRUE_779,Enkalu zeyongedde mu Uganda Law Society – oluvannyuma lwa kooti okuyimiriza Ttabamiruka,TRUE,CBS FM,traditional_media,Luganda,2026-02-19
UG_TRUE_780,Abasirikale ba police 4 abavunaanibwa ogw’okutulugunya omukyala e Mbarara – boolekedde kugobwa ku mulimu,TRUE,CBS FM,traditional_media,Luganda,2026-02-19
UG_TRUE_781,Wakiso eweereddwa obuwumbi 350 okukola enguudo – zitandika mu January 2025,TRUE,CBS FM,traditional_media,Luganda,2026-02-19
UG_TRUE_782,President Museveni awaanye Kooti y’amagye nti etebenkezza eggwanga erina okusigalawo,TRUE,CBS FM,traditional_media,Luganda,2026-02-19
UG_TRUE_783,"Besigye aziddwayo ku alimanda e Luzira okutuusa nga 7 January, 2025",TRUE,CBS FM,traditional_media,Luganda,2026-02-19
UG_TRUE_784,Bannamateeka 41 bebasunsuddwa kooti y’amagye okutandika okuwolereza Rtd Col. Dr.Kiiza Besigye,TRUE,CBS FM,traditional_media,Luganda,2026-02-19
UG_TRUE_785,FDC ye Najjanankumbi ekukkulumye olw’okusosolebwa mu nteekateeka z’okununula Dr.Kiiza Besigye,TRUE,CBS FM,traditional_media,Luganda,2026-02-19
UG_TRUE_786,Abazigu basse omukuumi w’ebbaala nebanyagulula ne Supermarket e Kijabijo,TRUE,CBS FM,traditional_media,Luganda,2026-02-19
UG_TRUE_787,Ababadde babba kasooli e Nakaseke bakubiddwa mizibu – n’emmotoka yaabwe eteekeddwa omuliro,TRUE,CBS FM,traditional_media,Luganda,2026-02-19
UG_TRUE_788,Omukadde yekumyeko omuliro e Kyotera – yasoose kulumiriza abaana be obutamufaako,TRUE,CBS FM,traditional_media,Luganda,2026-02-19
UG_TRUE_789,Mwetondere bemusobezza mu nnaku zino eza Ssekukkulu esembedde – Ssaabasumba Augustine Kasujja,TRUE,CBS FM,traditional_media,Luganda,2026-02-19
UG_TRUE_790,Ssaabalabirizi Kazimba Mugalu alabudde government ya Uganda ku bannauganda abagenze ku kyeyo,TRUE,CBS FM,traditional_media,Luganda,2026-02-19
UG_TRUE_791,Mathias Mpuuga atongozza ekisinde ky’obufuzi ekiggya – ki Democratic Alliance,TRUE,CBS FM,traditional_media,Luganda,2026-02-19
UG_TRUE_792,Government etandise okugezesa enkola y’okufunira abayizi eby’okulya ku masomero – etandika mu 2026,TRUE,CBS FM,traditional_media,Luganda,2026-02-19
UG_TRUE_793,President Museveni asuubizza okusaawo enkola empya ezinaasitula Kalamoja,TRUE,CBS FM,traditional_media,Luganda,2026-02-19
UG_TRUE_794,Nakayima asse 4 e Mubende – abalala 8 bapooca,TRUE,CBS FM,traditional_media,Luganda,2026-02-19
UG_TRUE_795,Omukuumi asangiddwa yattiddwa e Masajja,TRUE,CBS FM,traditional_media,Luganda,2026-02-19
UG_TRUE_796,"Dr.Kiiza Besigye ne munne baziddwayo ku alimanda okutuusa nga 10 December,2024",TRUE,CBS FM,traditional_media,Luganda,2026-02-19
UG_TRUE_797,Abapolice 5 basuumusiddwa amaddaala okumyuka Ssaabapolice wa Uganda,TRUE,CBS FM,traditional_media,Luganda,2026-02-19
UG_TRUE_798,Abaafiiridde mu kubumbulukuka kw’ettaka e Bulambuli baweze 22 – kawefube aliwo wakusomesa abantu abakyalemedde bifo ebiri mu katyabaga,TRUE,CBS FM,traditional_media,Luganda,2026-02-19
UG_TRUE_799,Ettaka libumbulukuse mu district ye Bulambuli neriziika amayumba – 15 baziikuddwayo nga bafudde,TRUE,CBS FM,traditional_media,Luganda,2026-02-19
UG_TRUE_800,Abantu abatanamanyibwa muwendo bateeberezebwa okuba nga bafiiridde mu mugga Tangi ogubooze negusalamu oluguudo oluva e Nwoya okudda e Pakwach,TRUE,CBS FM,traditional_media,Luganda,2026-02-19
UG_TRUE_801,Amataba gasazeemu oluguudo lwe Pakwach – abava e Kampala okudda e Ggulu newalala balabuddwa,TRUE,CBS FM,traditional_media,Luganda,2026-02-19
UG_TRUE_802,Abazigu balumbye ebyalo e Buloba nebatema abatuuze,TRUE,CBS FM,traditional_media,Luganda,2026-02-19
UG_TRUE_803,Abazzi b’emisango n’abatunda ebiragalalagala eby’obulabe bakugyibwangako endagaluse,TRUE,CBS FM,traditional_media,Luganda,2026-02-19
UG_TRUE_804,Government ya Uganda eteekateeka kutandikawo University y’eby’emikono – eyanjuddwa mu bbago ly’etteeka,TRUE,CBS FM,traditional_media,Luganda,2026-02-19
UG_TRUE_805,Nnaabagereka Nagginda akubirizza abakyala okwongera okuvuganya ku bifo by’obukulembeze,TRUE,CBS FM,traditional_media,Luganda,2026-02-19
UG_TRUE_806,Ppaapa alonze Fr. Dr. Constantine Rupiny okubeera omusumba w’essaza lye Nebbi,TRUE,CBS FM,traditional_media,Luganda,2026-02-19
UG_TRUE_807,Abakuumi ba G4S abagambibwa okubba sente ezisoba mu kawumbi kalamba mu Kampala police ebayigga – waliwo akwatiddwa n’obukadde 117,TRUE,CBS FM,traditional_media,Luganda,2026-02-19
UG_TRUE_808,Martha Karua yagenda okukulemberamu bannamateeka 50 abagenda okuwolereza Dr Kiiza Besigye,TRUE,CBS FM,traditional_media,Luganda,2026-02-19
UG_TRUE_809,President Museveni aliko abawagizi ba NUP 19 baawadde ekisonyiwo – Olivia Lutaaya yoomu kubasonyiyiddwa,TRUE,CBS FM,traditional_media,Luganda,2026-02-19
UG_TRUE_810,Abantu 2 bakubiddwa amasasi e Kiwaatule,TRUE,CBS FM,traditional_media,Luganda,2026-02-19
UG_TRUE_811,FDC etadde government ya Kenya ku nninga – basazeewo okugumba ku kitebe kyayo mu Uganda,TRUE,CBS FM,traditional_media,Luganda,2026-02-19
UG_TRUE_812,Dr.Kiiza Besigye asimbiddwa mu kooti y’amagye agguddwako emisango 4 ne munne – nebasindikibwa ku alimanda mu kkomera e Luzira,TRUE,CBS FM,traditional_media,Luganda,2026-02-19
UG_TRUE_813,Omumyuka wa RDC Majambere Ivan Kamuntu Ssemakula akwatiddwa,TRUE,CBS FM,traditional_media,Luganda,2026-02-19
UG_TRUE_814,President Museveni ayisizza ekiragiro ku babba sente za government – basibwe ate balagirwe n’okuzizza,TRUE,CBS FM,traditional_media,Luganda,2026-02-19
UG_TRUE_815,Dr.Kiiza Besigye atwalibwa mu kooti y’amagye – yakwatiddwa mu Kenya,TRUE,CBS FM,traditional_media,Luganda,2026-02-19
UG_TRUE_816,Banna NRM e Lwengo bagala omuwendo gw’ababaka ba parliament gukendeezebwe – nga bwekyakoleddwa ku bitongole bya government,TRUE,CBS FM,traditional_media,Luganda,2026-02-19
UG_TRUE_817,Government etangaazizza ku bya ‘Muzungu boda’ eyatikkiddwa ku nnyonyi nazzibwayo ewabwe,TRUE,CBS FM,traditional_media,Luganda,2026-02-19
UG_TRUE_818,Minister asabye alipoota ku by’okuzimba ekizimbe ku mwala gwe Nakivubo – Hamis Kiggundu yewozezaako,TRUE,CBS FM,traditional_media,Luganda,2026-02-19
UG_TRUE_819,Taata n’abaana be 3 basangiddwa bafiiridde mu nnyumba e Kyengera,TRUE,CBS FM,traditional_media,Luganda,2026-02-19
UG_TRUE_820,Okukuza emyaka 60 egy’Abajulizi ba Uganda- Ssaabasumba Ssemogerere alabudde bannauganda obutava kukulima mmwanyi,TRUE,CBS FM,traditional_media,Luganda,2026-02-19
UG_TRUE_821,Abantu 6 bateeberezebwa okuba nga bafiiridde mu kabenje akagudde e Kakira,TRUE,CBS FM,traditional_media,Luganda,2026-02-19
UG_TRUE_822,Ssaabasumba Ssemogerere yebazizza abakulira ettendekero lya Uganda Catholic Management and Training Institute – olw’okuzza essuubi mu bavubuka,TRUE,CBS FM,traditional_media,Luganda,2026-02-19
UG_TRUE_823,Ab’ebyokwerinda banunudde omukungu w’ekitebe kya Egypt mu Uganda – abawaambi babakwatidde Buloba,TRUE,CBS FM,traditional_media,Luganda,2026-02-19
UG_TRUE_824,Ddereeva eyali ayagala okutomera omusirikale wa police y’ebidduka alagiddwa okusasula engassi,TRUE,CBS FM,traditional_media,Luganda,2026-02-19
UG_TRUE_825,Omuliro gusaanyizaawo ekisulo ky’abayizi ku Wamatovu Umea S S Mpigi,TRUE,CBS FM,traditional_media,Luganda,2026-02-19
UG_TRUE_826,Emmundu eyabbibwa ku musirikale ng’akuuma ebigezo e Kyotera – esangiddwa mu mirandira gya Kalittunsi,TRUE,CBS FM,traditional_media,Luganda,2026-02-19
UG_TRUE_827,Ggoonya eridde omukazi abadde agenze okusena amazzi – ku mwalo gwe Ntuuwa,TRUE,CBS FM,traditional_media,Luganda,2026-02-19
UG_TRUE_828,Omumegganyi w’Entanda ya Buganda  2013 yoomu ku batudde ebigezo bya S.6 UNEB 2024,TRUE,CBS FM,traditional_media,Luganda,2026-02-19
UG_TRUE_829,"Abayizi 142,009 bebagenda okutuula ebigezo bya S.6  – UNEB 2024",TRUE,CBS FM,traditional_media,Luganda,2026-02-19
UG_TRUE_830,Emmotoka ekutte omuliro ku lutindo lwa Nambigirwa ku Entebbe Express Way,TRUE,CBS FM,traditional_media,Luganda,2026-02-19
UG_TRUE_831,Abazigu bateekedde omuliro ebyambalo bya bannaddiini mu eklezia ye Kigungu Mapeera,TRUE,CBS FM,traditional_media,Luganda,2026-02-19
UG_TRUE_832,President Museveni agambye nti abawakanya eky’okuggyawo ekitongole kya UCDA – balabe ba ggwanga,TRUE,CBS FM,traditional_media,Luganda,2026-02-19
UG_TRUE_833,Obwakabaka bwa Buganda ssibwakupondooka kukubiriza bantu okwerimira emmwanyi – Owe- Nsibirwa,TRUE,CBS FM,traditional_media,Luganda,2026-02-19
UG_TRUE_834,Abazigu basse omukuumi – emmundu bagitutte,TRUE,CBS FM,traditional_media,Luganda,2026-02-19
UG_TRUE_835,Abayizi ba P.7 batandise okukola ebibuuzo bya PLE 2024 –  abasibe 323 bebatuulidde mu makomera,TRUE,CBS FM,traditional_media,Luganda,2026-02-19
UG_TRUE_836,Bannauganda 80 ababadde baasibwa mu makomera g’e Buwalabu bayiimbuddwa nebadda ku butaka,TRUE,CBS FM,traditional_media,Luganda,2026-02-19
UG_TRUE_837,Omujaasi wa UPDF akubye banne amasasi omu amusse n’okulumya abalala – naye bamusse,TRUE,CBS FM,traditional_media,Luganda,2026-02-19
UG_TRUE_838,Abantu 3 bafiiridde mu kabenje akagudde ku lw’e Mbarara,TRUE,CBS FM,traditional_media,Luganda,2026-02-19
UG_TRUE_839,Dorothy Kisaka ne banne abaali bakulira KCCA bayimbuddwa ku kakalu ka kooti,TRUE,CBS FM,traditional_media,Luganda,2026-02-19
UG_TRUE_840,Omuliro gusaanyizaawo emmaali y’abantu mu Kakajjo Bweyogerere,TRUE,CBS FM,traditional_media,Luganda,2026-02-19
UG_TRUE_841,Laddu esse 14 e Lamwo abalala bakoseddwa – babadde banoonyi ba bubudamu,TRUE,CBS FM,traditional_media,Luganda,2026-02-19
UG_TRUE_842,Omumyuka w’Omulabirizi w’Obulabirizi bwa Kampala atuuziddwa  n’okutongoza lutikko empya – president Museveni awaddeyo obukadde bwa shs 100,TRUE,CBS FM,traditional_media,Luganda,2026-02-19
UG_TRUE_843,Omusirikale wa SFC eyatta ab’oLuganda 5 olw’enkaayana z’ettaka e Mayuge – asindikiddwa ku kalabba,TRUE,CBS FM,traditional_media,Luganda,2026-02-19
UG_TRUE_844,Omuwendo gw’abafiiridde mu muliro gw’e Kigoogwa gulinnye  – baweze 31,TRUE,CBS FM,traditional_media,Luganda,2026-02-19
UG_TRUE_845,Akabenje kagudde e Namboole – Taxi etomereganye ne mmotoka ya Buyonjo nekwata omuliro,TRUE,CBS FM,traditional_media,Luganda,2026-02-19
UG_TRUE_846,Essomero lya St.James Bbiina Primary School e Mutungo likutte omuliro,TRUE,CBS FM,traditional_media,Luganda,2026-02-19
UG_TRUE_847,Abaana 3 bafiiridde mu kabenje e Njeru,TRUE,CBS FM,traditional_media,Luganda,2026-02-19
UG_TRUE_848,Akakiiko k’eddembe ly’obuntu mu Wakiso kalabudde ku mmere ekolebwa nga teriimu biriisa – kawagidde ebbago ly’etteeka ly’emmere erireetebwa,TRUE,CBS FM,traditional_media,Luganda,2026-02-19
UG_TRUE_849,Police eggalidde abayizi ba Kyambogo University 11 – bateeberezebwa okwenyigira mu kwekalakaasa,TRUE,CBS FM,traditional_media,Luganda,2026-02-19
UG_TRUE_850,Abantu baweze 24 abaafiira mu muliro ogwakwata emmotoka y’amafuta e Kigoogwa,TRUE,CBS FM,traditional_media,Luganda,2026-02-19
UG_TRUE_851,President Museven agambye nti UCDA kye kimu ku bitongole ebibadde binyunyuunta government era kirina okuvaawo,TRUE,CBS FM,traditional_media,Luganda,2026-02-19
UG_TRUE_852,Omulembe gwa bannantagambwako guvudde ku bazadde kusuulirira baana babwe – Ssaabasumba Ssemogerere,TRUE,CBS FM,traditional_media,Luganda,2026-02-19
UG_TRUE_853,Abantu 3 bafiiridde mu bubenje obugudde e Masaka – Lukululana zitomereganye,TRUE,CBS FM,traditional_media,Luganda,2026-02-19
UG_TRUE_854,Omuliro gukutte ennyumba e Kamwokya – omwana afiiriddemu abalala balumiziddwa,TRUE,CBS FM,traditional_media,Luganda,2026-02-19
UG_TRUE_855,Okukebera endagabutonde ku bantu abafiiriddwako abaabwe mu muliro ogwavudde ku mafuta e Kigoogwa kuwedde,TRUE,CBS FM,traditional_media,Luganda,2026-02-19
UG_TRUE_856,Eyali omuwandiisi wa kooti ya Kisekwa Milly Naluwenda – agyiddwako emisango gy’okutemula eyali omukulu w’ekika ky’Endiga Eng.Daniel Bbosa,TRUE,CBS FM,traditional_media,Luganda,2026-02-19
UG_TRUE_857,Ssenkulu wa KCCA omuggya Frank Nyakaana alambise byatandikirako okukola – essira alitadde ku kukulwanyisa nguzi,TRUE,CBS FM,traditional_media,Luganda,2026-02-19
UG_TRUE_858,Amannya g’abantu 15 gegaakawebwayo – abagambibwa nti bebaafiiridde mu muliro ogwavudde ku mmotoka y’amafuta,TRUE,CBS FM,traditional_media,Luganda,2026-02-19
UG_TRUE_859,Parliament eyisizza etteeka eppya ku bibira – NFA eggyiddwawo,TRUE,CBS FM,traditional_media,Luganda,2026-02-19
UG_TRUE_860,Government eyongedde okumyumyula etteeka erikwata kukubowa endagamuntu – osobola okusibwa emyaka 3,TRUE,CBS FM,traditional_media,Luganda,2026-02-19
UG_TRUE_861,Abantu 11 bakakasiddwa nti bafiiridde mu muliro oguvudde ku mmotoka y’amafuta egudde e Matugga,TRUE,CBS FM,traditional_media,Luganda,2026-02-19
UG_TRUE_862,Abantu abatanamanyika muwendo bafiiridde mu muliro oguvudde  ku mmotoka y’amafuta e Matugga,TRUE,CBS FM,traditional_media,Luganda,2026-02-19
UG_TRUE_863,Abatuuze bataasizza omwana abadde awambiddwa e Ssembabule,TRUE,CBS FM,traditional_media,Luganda,2026-02-19
UG_TRUE_864,AIDO Network International etongozza kaweefube w’okubanja ebintu by’obuwangwa bwa Africa ebikyakuumibwa abazungu,TRUE,CBS FM,traditional_media,Luganda,2026-02-19
UG_TRUE_865,Okujaguza emyaka 60 egy’Abajulizi ba Uganda – mu St.Peter’s Basilica e Vatican,TRUE,CBS FM,traditional_media,Luganda,2026-02-19
UG_TRUE_866,Kisaka ne banne basindikiddwa ku alimanda e Luzira,TRUE,CBS FM,traditional_media,Luganda,2026-02-19
UG_TRUE_867,Omujaasi wa UPDF attiddwa e Ssembabule,TRUE,CBS FM,traditional_media,Luganda,2026-02-19
UG_TRUE_868,Abaali bakulira KCCA – Dorothy Kisaka ne banne batuusiddwa mu kooti e Kasaangati ku by’emisango gy’e Kiteezi,TRUE,CBS FM,traditional_media,Luganda,2026-02-19
UG_TRUE_869,Ababbi bamenye amaduuka eKiriri Gomba – omu attiddwa,TRUE,CBS FM,traditional_media,Luganda,2026-02-19
UG_TRUE_870,UNRA erina ebyapa ebisoba mu 6000 – bya bannauganda abaabiwaayo kusalibweko ettaka ly’enguudo,TRUE,CBS FM,traditional_media,Luganda,2026-02-19
UG_TRUE_871,Okusabira omugenzi Bishop Samuel Balagadde Ssekkadde mu lutikko e Namirembe,TRUE,CBS FM,traditional_media,Luganda,2026-02-19
UG_TRUE_872,Abantu 4 bafiiridde mu kabenje akagudde ku Lubaga road mu Kampala,TRUE,CBS FM,traditional_media,Luganda,2026-02-19
UG_TRUE_873,Abakuumi banywedde omwenge gwebabadde bakuuma nebasuula emmundu e Kyotera – Police ebakutte,TRUE,CBS FM,traditional_media,Luganda,2026-02-19
UG_TRUE_874,Abantu 6 bafiiridde mu kabenje e Luweero,TRUE,CBS FM,traditional_media,Luganda,2026-02-19
UG_TRUE_875,Dorothy Kisaka ne banne basuze mu kaduukulu ka police,TRUE,CBS FM,traditional_media,Luganda,2026-02-19
UG_TRUE_876,"Eyali Omulabirizi we Namirembe Balagadde Ssekadde aziikibwa ku Thursday nga 17 October,2024",TRUE,CBS FM,traditional_media,Luganda,2026-02-19
