id,text,label,source,platform_type,language,date_collected
UG_TRUE_1205,Abayizi 4 ab’ettendekero lya Buganda Royal Institute Mengo bafiiridde mu Kabenje,TRUE,CBS FM,traditional_media,Luganda,2026-02-19
UG_TRUE_1206,Parliament egaanye okuyisa ensimbi obuwumbi 200 ezirina okuliyirira abakozi abagenda okufiirwa emirimu mu kitongole kya UNRA,TRUE,CBS FM,traditional_media,Luganda,2026-02-19
UG_TRUE_1207,Government eweerezza obuwumbi bwa shs 7 n’obukadde 687 ez’okukola emirimu egiggalawo omwaka gw’ebyensimbi 2023/2024,TRUE,CBS FM,traditional_media,Luganda,2026-02-19
UG_TRUE_1208,Police e Kassanda ekutte ssemaka ateeberezebwa okutta mukyala we ng’amuteebereza okubaliga,TRUE,CBS FM,traditional_media,Luganda,2026-02-19
UG_TRUE_1209,Entambula esannyaladde e Ssembabule olw’omugga Kakyinga ogubooze,TRUE,CBS FM,traditional_media,Luganda,2026-02-19
UG_TRUE_1210,Emisinde gy’amazaalibwa ga Kabaka e SouthAfrica  bagiddukidde ku miramwa 3 – batongozza ne Luwalo lwange 2024,TRUE,CBS FM,traditional_media,Luganda,2026-02-19
UG_TRUE_1211,Okusaala Eid- Elfitr e Kampala  Mukadde – Mufti Mubajje ayagala amawanga gonna gakwatire wamu okulwanyisa olutalo oluli e Palastine,TRUE,CBS FM,traditional_media,Luganda,2026-02-19
UG_TRUE_1212,Kooti egaanye eby’okuyimbula Namwandu wa Henry Katanga – wakutandika okwewozaako mu July wa 2024,TRUE,CBS FM,traditional_media,Luganda,2026-02-19
UG_TRUE_1213,MunnaUganda Paschael Ssekasamba abadde asinga okutunda emmere ya Uganda ennansi mu Bungereza afudde kibwatukira,TRUE,CBS FM,traditional_media,Luganda,2026-02-19
UG_TRUE_1214,Obwakabaka bwa Buganda bufulumizza ennambika y’emikolo gy’amazaalibwa ga Ssaabasajja Kabaka age 69 – wategekeddwawo ebyoto okwetoloola amasaza gonna,TRUE,CBS FM,traditional_media,Luganda,2026-02-19
UG_TRUE_1215,Abaana 2 bagiiridde mu nju ku bizinga e Buvuma – abatuuze nebalaajana olw’obutaba na Kabuyonjo,TRUE,CBS FM,traditional_media,Luganda,2026-02-19
UG_TRUE_1216,Abetabye mu misinde gy’amazaalibwa ga Kabaka agy’omwaka 2024 beyanzizza Ssaabasajja okusiima n’akulemberamu olutalo lw’okulwanyisa siriimu,TRUE,CBS FM,traditional_media,Luganda,2026-02-19
UG_TRUE_1217,Map y’emisinde gy’amazaalibwa ga Kabaka 2024 efulumye,TRUE,CBS FM,traditional_media,Luganda,2026-02-19
UG_TRUE_1218,Laddu ekubye omutuuze nemuttirawo mu district ye Bukomansimbi,TRUE,CBS FM,traditional_media,Luganda,2026-02-19
UG_TRUE_1219,Omuliro gusaanyizaawo Bravo Cafe Restaurant ku Uganda House,TRUE,CBS FM,traditional_media,Luganda,2026-02-19
UG_TRUE_1220,Envubu eziinze omwalo gwe Namaziina – esse omuvubi omu abalala basattira,TRUE,CBS FM,traditional_media,Luganda,2026-02-19
UG_TRUE_1221,Omwana afiiridde mu muliro ogukutte ennyumba y’omutuuze e Luweero,TRUE,CBS FM,traditional_media,Luganda,2026-02-19
UG_TRUE_1222,Government ya Uganda etongozza akatabo akannyonyola embalirira y’eggwanga akasobola okusomebwa abantu abatalaba,TRUE,CBS FM,traditional_media,Luganda,2026-02-19
UG_TRUE_1223,President Museven ayongezaayo endagaano ya Johnson Byabashaija nga ye ssenkulu w’ekitongole ky’amakomera mu Uganda – agenda mu myaka 20 nga ye ssenkulu wakyo,TRUE,CBS FM,traditional_media,Luganda,2026-02-19
UG_TRUE_1224,Olukwe lw’okubba essundiro ly’amafuta e Luweero luteeberezebwa okubaamu omukuumi walyo – Police,TRUE,CBS FM,traditional_media,Luganda,2026-02-19
UG_TRUE_1225,Kooti etaputa ssemateeka egaanye okusazaamu etteeka eriwera ebisiyaga mu Uganda – abalamuzi balambise ku bumu ku buwaayiro obulina okusazibwamu,TRUE,CBS FM,traditional_media,Luganda,2026-02-19
UG_TRUE_1226,Police ekutte 4 abagambibwa okubeera abanyazi b’emmotoka ne bodaboda mu kibuga Kampala,TRUE,CBS FM,traditional_media,Luganda,2026-02-19
UG_TRUE_1227,Omusirikale wa UPDF omulala Brig.Gen.Stephen Kiggundu asaangiddwa afiiridde mu kinaabiro,TRUE,CBS FM,traditional_media,Luganda,2026-02-19
UG_TRUE_1228,Katikkiro Mayiga awadde amagezi wassibwewo akakiiko akagereka emisaala gy’abakungu n’abakozi ba government bonna – n’omuwendo gw’ababaka ba parliament gukendeezebweko,TRUE,CBS FM,traditional_media,Luganda,2026-02-19
UG_TRUE_1229,President Museven asiimye bannaddiini avuddeyo mu ddoboozi ery’omwanguka okuvumirira enguzi – alabudde ba RDC nti balemeddwa okulwanyisa obulyake,TRUE,CBS FM,traditional_media,Luganda,2026-02-19
UG_TRUE_1230,Okutambuza ekkubo ly’omusaalaba mu Uganda 2024 – lyesigamiziddwa ku bubaka obw’okusonyiwagana n’okutabagana,TRUE,CBS FM,traditional_media,Luganda,2026-02-19
UG_TRUE_1231,Ssaabasajja Kabaka aweerezza obubaka bwa Ppaasika 2024 – akubirizza abantu okunywerera ku mazima n’obutegaana bantu bannaffe,TRUE,CBS FM,traditional_media,Luganda,2026-02-19
UG_TRUE_1232,Government etongozza ettendekero ly’abavuga tractor ezikola enguudo – abamalirizza S.4 bakuganyulwa,TRUE,CBS FM,traditional_media,Luganda,2026-02-19
UG_TRUE_1233,Tukooye okutusuubiza obukunkumuka bw’omusaala – abakulembeze ba government ez’ebitundu batabuse,TRUE,CBS FM,traditional_media,Luganda,2026-02-19
UG_TRUE_1234,Abakyala be Bussi balaajanye abasajja baabasuulira amaka,TRUE,CBS FM,traditional_media,Luganda,2026-02-19
UG_TRUE_1235,KCCA kyadaaki efulumizza obuwumbi bwa shs 2.7 zisasule abakozi abalongoosa enguudo,TRUE,CBS FM,traditional_media,Luganda,2026-02-19
UG_TRUE_1236,Ababadde bagenda okuziika 9 bafiiridde mu kabenje e Rakai,TRUE,CBS FM,traditional_media,Luganda,2026-02-19
UG_TRUE_1237,Ssaabasumba Ssemogerere alambudde abasibe mu kkomera – abamazeeyo ebbanga eddene nga tebawozesebwa bamulaajanidde,TRUE,CBS FM,traditional_media,Luganda,2026-02-19
UG_TRUE_1238,Abakozi ba KCCA abeera ku nguudo bazeemu okwegugunga – babanja omusaala gwa myezi 5,TRUE,CBS FM,traditional_media,Luganda,2026-02-19
UG_TRUE_1239,Prof.Gilbert Bukenya alagidde nti ebyapa byonna ebiri ku kibira kya government eky’e Kitubulu Ntebbe bisazibwemu,TRUE,CBS FM,traditional_media,Luganda,2026-02-19
UG_TRUE_1240,Emmotoka 5 zitomereganye – omuntu omu afiiriddewo abalala bali mu malwaliro bapooca,TRUE,CBS FM,traditional_media,Luganda,2026-02-19
UG_TRUE_1241,Eby’okunoonyereza ku nguzi mu parliament ya Uganda byongedde okukaluba – IGG,TRUE,CBS FM,traditional_media,Luganda,2026-02-19
UG_TRUE_1242,Police eragidde ebirombe bya Zzaabu byonna ebitalina bintu bikozesebwa okutaasa ababikoleramu biggalwewo,TRUE,CBS FM,traditional_media,Luganda,2026-02-19
UG_TRUE_1243,Omulabirizi Wilson Kisekka atuuziddwa ng’omulabirizi owookuna owe Luweero- asabiddwa okulwana okugatta abakulisitaayo,TRUE,CBS FM,traditional_media,Luganda,2026-02-19
UG_TRUE_1244,Okujjukira olunaku lw’amatabi – okukuuma obutonde bw’ensi bussiddwa ku bwanjo,TRUE,CBS FM,traditional_media,Luganda,2026-02-19
UG_TRUE_1245,Abadde ayokya ebyuma bya Scrap akubiddwa ekiteeberezebwa okuba bbomu – kimukutuddeko amagulu abalala bapooca,TRUE,CBS FM,traditional_media,Luganda,2026-02-19
UG_TRUE_1246,Buwule and Mayiga advocates ejaguzza emyaka 30 ng’eweereza bannauganda mu by’amateeka,TRUE,CBS FM,traditional_media,Luganda,2026-02-19
UG_TRUE_1247,Paapa Francis alonze Rev. Raphael P’Mony Wokorach okubeera Ssaabasumba omuggya ow’essaza ekkulu erye Ggulu,TRUE,CBS FM,traditional_media,Luganda,2026-02-19
UG_TRUE_1248,Gen. Muhoozi Kainerugaba ku myaka 25 ayingira eggye ly’eggwanga – oluvannyuma lw’emyaka 25 ye muduumizi walyo,TRUE,CBS FM,traditional_media,Luganda,2026-02-19
UG_TRUE_1249,Gen.Muhoozi Kainerugaba alondeddwa ng’Omuduumizi w’eggye ly’eggwanga – asikidde Gen.Wilson Mbasu Mbadi,TRUE,CBS FM,traditional_media,Luganda,2026-02-19
UG_TRUE_1250,President Museven akyusizza ba minister be,TRUE,CBS FM,traditional_media,Luganda,2026-02-19
UG_TRUE_1251,Omukuumi akubye mukazi we amasasi naye neyeekuba – bombi bapooca,TRUE,CBS FM,traditional_media,Luganda,2026-02-19
UG_TRUE_1252,Bishop Michael Ssenyimba Kitalo : 1937 – 2024,TRUE,CBS FM,traditional_media,Luganda,2026-02-19
UG_TRUE_1253,"Kooti etaddewo olwa nga 02 July,2024 okutandika okuwulira omusango gw’okutemula omusuubuzi Henry Katanga",TRUE,CBS FM,traditional_media,Luganda,2026-02-19
UG_TRUE_1254,Okubala abantu mu Uganda kwakuwemmenta obuwumbi bwa shs 399 – district ye Wakiso yesiingamu ebisomooza,TRUE,CBS FM,traditional_media,Luganda,2026-02-19
UG_TRUE_1255,Nabbi Elijah Kimera asaliddwa ekibonerezo kya myaka 40 – asingisiddwa omusango gw’okukabasanya omwana ataneetuuka n’amuzaalamu abalongo n’okumuwereba obulwadde,TRUE,CBS FM,traditional_media,Luganda,2026-02-19
UG_TRUE_1256,Police etuuse ku bukadde bwa shs 20 – ziweebwe anaabatuusa ku Luggya Bbosa Tabula agambibwa okuluka olukwe lw’okutemula Omutaka Eng.Daniel Bbosa,TRUE,CBS FM,traditional_media,Luganda,2026-02-19
UG_TRUE_1257,Abagambibwa okukusa abantu okubatwala e Libya 5 bakwatiddwa,TRUE,CBS FM,traditional_media,Luganda,2026-02-19
UG_TRUE_1258,Bishop Ssebaggala asiibudde ab’e Luweero – abalabudde nti bwebatava mu nkaayana enkulaakulana yakubaleka emabega,TRUE,CBS FM,traditional_media,Luganda,2026-02-19
UG_TRUE_1259,Nyenga Seminary ewezezza emyaka 100 beddu: 1924 – 2024,TRUE,CBS FM,traditional_media,Luganda,2026-02-19
UG_TRUE_1260,Omwaka guweze mulamba emmotoka ya Sino Truck lweyayiingirira essomero lya Kasaka SS n’etta abayizi – abazadde n’essomero bakukkuluma obwenkanya bukyabuze,TRUE,CBS FM,traditional_media,Luganda,2026-02-19
UG_TRUE_1261,Abaana b’essomero 2 bafiiridde mu luzzi e Kassanda – abakulira essomero badduse,TRUE,CBS FM,traditional_media,Luganda,2026-02-19
UG_TRUE_1262,Omuliro guzeemu okusanyaawo ekibanda ky’embaawo e Masaka – business zonna ezibaddewo zitokomose,TRUE,CBS FM,traditional_media,Luganda,2026-02-19
UG_TRUE_1263,UNRA yewozezaako ku by’oluguudo oluva e Masaka  okudda e Mutukula oluli mu mbeera embi,TRUE,CBS FM,traditional_media,Luganda,2026-02-19
UG_TRUE_1264,Abantu 10 bafiiridde mu kabenje ka mmotoka ezikutte omuliro ku luguudo oluva e Bugiri okudda e Malaba,TRUE,CBS FM,traditional_media,Luganda,2026-02-19
UG_TRUE_1265,Kaliisoliiso akutte abakozi ba government 10 abagambibwa okulya ensimbi za Covid 19,TRUE,CBS FM,traditional_media,Luganda,2026-02-19
UG_TRUE_1266,Omusirikale wa police asaangiddwa ng’afiiridde munju – kigambibwa nti yaggya ensimbi ku musibe nazizannyamu zzaala,TRUE,CBS FM,traditional_media,Luganda,2026-02-19
UG_TRUE_1267,Abantu 5 abateeberezebwa okutemula Omutaka Eng.Daniel Bbosa basindikiddwa ku alimanda,TRUE,CBS FM,traditional_media,Luganda,2026-02-19
UG_TRUE_1268,Okukuza olunaku lw’abakyala 2024 – abakyala abaasomye amawulire ku mikutu gya CBS FM balunyumya nga lutabaalo,TRUE,CBS FM,traditional_media,Luganda,2026-02-19
UG_TRUE_1269,Abayizi abawala bongedde okusitula omutindo mu nkola y’ebigezo – abaasiinze mu Makerere College School bonna bawala.,TRUE,CBS FM,traditional_media,Luganda,2026-02-19
UG_TRUE_1270,President Museven alabudde abawala abagenda okukuba ebyeyo mu mawanga amalala nti boonoona ebiseera byabwe,TRUE,CBS FM,traditional_media,Luganda,2026-02-19
UG_TRUE_1271,Ebibuuzo bya S.6 ebya 2023 bikomyewo –  abayizi ebitundu 99% baabiyise,TRUE,CBS FM,traditional_media,Luganda,2026-02-19
UG_TRUE_1272,Canon Wilson Kisekka ye mulabirizi w’e Luweero omulonde,TRUE,CBS FM,traditional_media,Luganda,2026-02-19
UG_TRUE_1273,Abakulira ebyenjigiriza basisinkanye ku ntegeka z’okufulumya ebyava mu bigezo bya UACE 2023,TRUE,CBS FM,traditional_media,Luganda,2026-02-19
UG_TRUE_1274,Ssaabawaabi wa government ayongedde okuleeta obujulizi ku bagambibwa okutemula Joan Kagezi – omusawo w’ekinnansi gyebaagenda okusiba omusango abalumiriza,TRUE,CBS FM,traditional_media,Luganda,2026-02-19
UG_TRUE_1275,Taata agambibwa okwewola ensimbi nezimulemerera okusasula obusungu abumalidde ku baana – omu amuttiddewo,TRUE,CBS FM,traditional_media,Luganda,2026-02-19
UG_TRUE_1276,Abapolice 7 ababadde bavunaanibwa egy’okuwamba bannansi ba Rwanda 3 nebabazza ku butaka – begyereedde,TRUE,CBS FM,traditional_media,Luganda,2026-02-19
UG_TRUE_1277,Ba Ssaabalamuzi b’amawanga ga Africa bagala kooti z’obuwangwa ziwebwe enkizo mu kusala emisango – president Museven asuubizza okugiwagira,TRUE,CBS FM,traditional_media,Luganda,2026-02-19
UG_TRUE_1278,Government eyagala okunywa omwenge kutandikire ku myaka 21 – n’ebika by’omwenge ebimu biwerebwe,TRUE,CBS FM,traditional_media,Luganda,2026-02-19
UG_TRUE_1279,Police etaddewo obukadde bwa shs 10 ezigenda okuweebwa omuntu anaagituusa ku musajja ateeberezebwa okupangisa abaatemula omutaka Eng.Daniel Bbosa – abantu 7 bebaakakwatibwa,TRUE,CBS FM,traditional_media,Luganda,2026-02-19
UG_TRUE_1280,Martin Okoth Ochola mu butongole awaddeyo wofiisi ya Ssaabapolice wa Uganda eri omumyuka we – awandiise ekitabo kya miko 300 atottola byakoledde police,TRUE,CBS FM,traditional_media,Luganda,2026-02-19
UG_TRUE_1281,Abantu 77 bafiiridde mu bubenje bw’okunguudo – 22 baabatomedde batambula,TRUE,CBS FM,traditional_media,Luganda,2026-02-19
UG_TRUE_1282,Embuzi ezaagula obukadde bwa shs 7 buli emu zitabudde ababaka ba parliament – balagidde police enoonyereze ku baazigula,TRUE,CBS FM,traditional_media,Luganda,2026-02-19
UG_TRUE_1283,Maj.Gen. Tumusiime Katsigazi yagenda okugira ng’akuuma entebe ya Ssabapolice wa Uganda – ekisanja kya Martin Okoth Ochola kiweddeko,TRUE,CBS FM,traditional_media,Luganda,2026-02-19
UG_TRUE_1284,Ababaka ba parliament basattira lwa bafere ababanyagako ensimbi zabwe,TRUE,CBS FM,traditional_media,Luganda,2026-02-19
UG_TRUE_1285,Obwakabaka bwa Buganda butandise okunoonyereza ku mukozi wabwo eyawambiddwa ku mudumu gw’emmundu,TRUE,CBS FM,traditional_media,Luganda,2026-02-19
UG_TRUE_1286,Ab’ebyokwerinda bezoobye n’abeera enguudo mu Kampala – bazinzeeko parliament,TRUE,CBS FM,traditional_media,Luganda,2026-02-19
UG_TRUE_1287,Police e Kassanda ekutte omukulu w’essomero agambibwa okusobya ku muyizi,TRUE,CBS FM,traditional_media,Luganda,2026-02-19
UG_TRUE_1288,Abe Masuuliita enkuba ebalese mu bbanga,TRUE,CBS FM,traditional_media,Luganda,2026-02-19
UG_TRUE_1289,Government eyimirizza enteekateeka y’abayizi ba S.4 ababadde balina okukola ebigezo bya UNEB mu June ne July 2024,TRUE,CBS FM,traditional_media,Luganda,2026-02-19
UG_TRUE_1290,Omukyala agambibwa okuba nga yawambiddwa e Ssembabule – asuuliddwa mu kibira e Mityana ng’asaliddwako enviiri,TRUE,CBS FM,traditional_media,Luganda,2026-02-19
UG_TRUE_1291,Kabaka Birthday run 2024 nga 7 April – obukiiko obuteesiteesi butongozeddwa,TRUE,CBS FM,traditional_media,Luganda,2026-02-19
UG_TRUE_1292,Enkuba egoyezza Bunjakko ne Muduuma – ebirime bikulugguse,TRUE,CBS FM,traditional_media,Luganda,2026-02-19
UG_TRUE_1293,Police efulumizza amannya g’abatemu abasse Omutaka Lwomwa,TRUE,CBS FM,traditional_media,Luganda,2026-02-19
UG_TRUE_1294,Omuliro gusaanyizaawo ekifo ekisanyukirwamu mu Kampala,TRUE,CBS FM,traditional_media,Luganda,2026-02-19
UG_TRUE_1295,Amazike gabbye omwana ow’emyezi 6 negamutta – gamusanze mu nnimiro,TRUE,CBS FM,traditional_media,Luganda,2026-02-19
UG_TRUE_1296,Omukulu w’ekika ky’Endiga Lwomwa Daniel Bbosa akubiddwa amasasi agamuttiddewo,TRUE,CBS FM,traditional_media,Luganda,2026-02-19
UG_TRUE_1297,Enteekateeka z’okusengula ekkomera lye Luzira zitandise – ettaka kweritudde kugenda kuzimbibwako woteeri ey’omulembe,TRUE,CBS FM,traditional_media,Luganda,2026-02-19
UG_TRUE_1298,Inebantu Jovia Mutesi agabudde Obusoga ekijjulo ekisoose,TRUE,CBS FM,traditional_media,Luganda,2026-02-19
UG_TRUE_1299,Excel Vocational Training Centre etikkidde abayizi 900 – baweereddwa amagezi okwettanira sente za Parish Development model bafune entandikwa,TRUE,CBS FM,traditional_media,Luganda,2026-02-19
UG_TRUE_1300,Abadde avvoola Ssaabasajja Kabaka ng’akozesa omutimbagano asindikiddwa ku alimanda,TRUE,CBS FM,traditional_media,Luganda,2026-02-19
UG_TRUE_1301,Ebintu by’abayizi bisaanyewo ku ssomero lya God Cares Christian primary School e Kalungu,TRUE,CBS FM,traditional_media,Luganda,2026-02-19
UG_TRUE_1302,Police e Bukomansimbi ekutte 2 abagambibwa okutta omuntu ateeberezebwa okubba emmwanyi ku misiri,TRUE,CBS FM,traditional_media,Luganda,2026-02-19
UG_TRUE_1303,Makerere University etongozza ekkadiyizo ly’ebintu bya Ssekabaka Muteesa II –  Ssaabasajja alagidde abavubuka okutaasa ennimi ennansi,TRUE,CBS FM,traditional_media,Luganda,2026-02-19
UG_TRUE_1304,Okukuza olunaku lw’ensi yonna olw’ennimi ennansi  – abaana ebitundu 40% tebamanyi kwogera nnimi zabwe,TRUE,CBS FM,traditional_media,Luganda,2026-02-19
UG_TRUE_1305,Omusirikale wa millitary police akubye muganziwe amasasi agamusse naye neyetta,TRUE,CBS FM,traditional_media,Luganda,2026-02-19
UG_TRUE_1306,Ab’oLuganda lw’abajaasi ba UPDF abaafiira e Somalia bakyabanja,TRUE,CBS FM,traditional_media,Luganda,2026-02-19
UG_TRUE_1307,Ekisulo ky’abayizi ba Creamland e Iganga kikutte omuliro,TRUE,CBS FM,traditional_media,Luganda,2026-02-19
UG_TRUE_1308,Omusirikale w’amakomera attiddwa mu bukambwe – police ekutte mukyalawe,TRUE,CBS FM,traditional_media,Luganda,2026-02-19
UG_TRUE_1309,Government ne Eklezia bakuziimba ekkadiyizo ly’ebikwata ku Kalidinaali Emmanuel Wamala – President Museveni yagenda okubeera omuyima waalyo,TRUE,CBS FM,traditional_media,Luganda,2026-02-19
UG_TRUE_1310,Abaali abakozi b’ekitongole ki Uganda Posta and Telecommunications Corporation ekyasattululwa mu 1997 –  bakyabanja government,TRUE,CBS FM,traditional_media,Luganda,2026-02-19
UG_TRUE_1311,Okujjukira Rev. Eliasaph Sserwadda – president Museveni asabye bannaddiini bakulemberemu kawefube w’okwagazisa abantu enteekateeka za government ez’okubaggya mu bwavu,TRUE,CBS FM,traditional_media,Luganda,2026-02-19
UG_TRUE_1312,Minister wa Kampala ayisizza nsalesale wa wiiki 2 – abatembeeyi bonna abakolera ku nguudo za Kampala bazaamuke,TRUE,CBS FM,traditional_media,Luganda,2026-02-19
UG_TRUE_1313,Parliament eye 11 egenda kuddamu okutuula okukubaganya ebirowoozo ku nnambika y’embalirira y’eggwanga eya 2026/2027,TRUE,CBS FM,traditional_media,Luganda,2026-02-19
UG_TRUE_1314,Kooti eyongezzaayo omusango gw’abasuubuzi abaali bakolera mu ppaaka esaangibwa mu Kitooro Ntebbe – balumiriza abakulira municipality obutabafaako,TRUE,CBS FM,traditional_media,Luganda,2026-02-19
UG_TRUE_1315,Boodi ya Mengo Chamber of Commerce Ltd etongozeddwa – okwongera okusitula eby’obusuubuzi mu Buganda,TRUE,CBS FM,traditional_media,Luganda,2026-02-19
UG_TRUE_1316,Government ya Uganda egumizza bannauganda nti siyakuggyako mayengo ga internet mu kulonda kwa 2026,TRUE,CBS FM,traditional_media,Luganda,2026-02-19
UG_TRUE_1317,Uganda ng’ekolagana ne Saudi Arabia zigenda kuzimba ekkolero e Luweero eryongera omutindo ku mmwanyi  – lyakuwemmenta obuwumbi bwa shs obusoba mu 574,TRUE,CBS FM,traditional_media,Luganda,2026-02-19
UG_TRUE_1318,Government etaddewo obukwakkulizo ku bayingiza mu Uganda ebyuma by’empuliziganya ebya kampuni ya StarLink – ababireeta balina okufuna olukusa okuva eri amagye g’eggwanga,TRUE,CBS FM,traditional_media,Luganda,2026-02-19
UG_TRUE_1319,Government ya Uganda ekoze enteekateeka yakukuηaanya omusolo gwa Trillion 40,TRUE,CBS FM,traditional_media,Luganda,2026-02-19
UG_TRUE_1320,Bannauganda abakolera mu Nyakuron Market mu SouthSudan bali mu maziga olw’emmaali yabwe eyasirikkidde mu muliro,TRUE,CBS FM,traditional_media,Luganda,2026-02-19
UG_TRUE_1321,Omuliro gukutte ekitundu ku katale k’e Nakasero,TRUE,CBS FM,traditional_media,Luganda,2026-02-19
UG_TRUE_1322,Abadde yeyita ssenkulu wa Statehouse investors’ protection Unit akwatiddwa – kigambibwa nti abadde abbye ku bantu ensimbi ezisoba mu buwumbi bwa shs 3,TRUE,CBS FM,traditional_media,Luganda,2026-02-19
UG_TRUE_1323,Government ya Uganda eyagala bamusigansimbi abava mu kyondo kya Buwalabu – okuleeta amakolero mu Uganda agagatta omutindo ku bintu ebiva mu Uganda,TRUE,CBS FM,traditional_media,Luganda,2026-02-19
UG_TRUE_1324,"Government ya Uganda eyagala abakozi 6,858 etandise okuwandiisa abagyetaaga",TRUE,CBS FM,traditional_media,Luganda,2026-02-19
UG_TRUE_1325,Okulwanyisa kalusu okwetoloola Uganda – district ye Ssembabule efunye ddoozi emitwalo 16,TRUE,CBS FM,traditional_media,Luganda,2026-02-19
UG_TRUE_1326,President Museveni wakukwasizaako abasuubuzi abaakosebwa amataba mu Kampala  sso ssikubaliyirira – Ssaabaminisita Nabbanja abataangaazizza,TRUE,CBS FM,traditional_media,Luganda,2026-02-19
UG_TRUE_1327,Abasuubuzi abaakosebwa amataba mu Kampala bakalambidde bagala KCCA ebaliyirire – abalala baddukidde mu kooti bagala eyimirize Hammis Kiggundu okuziimba ku mwala gwe Nakivubo,TRUE,CBS FM,traditional_media,Luganda,2026-02-19
UG_TRUE_1328,Abaana 4 bafiiridde mu nkuba etonnye mu Kampala – emmaali y’abasuubuzi nayo eyonooneddwa,TRUE,CBS FM,traditional_media,Luganda,2026-02-19
UG_TRUE_1329,President Museveni alonze Lino Anguzu okufuuka Ssaabawaabi w’emisango gya government omuggya,TRUE,CBS FM,traditional_media,Luganda,2026-02-19
UG_TRUE_1330,"Government ya Uganda esabye embalirira y’ennyongereza z’ensimbi okukola enguudo – kuliko oluva e Kisubi okudda e Nakawuka, Nateete okudda e Maya",TRUE,CBS FM,traditional_media,Luganda,2026-02-19
UG_TRUE_1331,Nabbambula w’omuliro asaanyizzaawo emmaali y’abasuubuzi ku mwalo gwe Kigungu,TRUE,CBS FM,traditional_media,Luganda,2026-02-19
UG_TRUE_1332,Government erabudde ebitongole by’obwannanyini ebiremereddwa okugoberera ennambika y’enkulaakana y’omulundi ogwokuna – siyakuddamu kukola nabyo ndagaano yonna,TRUE,CBS FM,traditional_media,Luganda,2026-02-19
UG_TRUE_1333,Government ya Uganda efulumizza ensimbi shs Trillion 18 n’obuwumbi 403 – okutambuza emirimu mu bitongole byayo mu ttundutundu eryokubiri ery’embalirira y’eggwanga 2025/2026,TRUE,CBS FM,traditional_media,Luganda,2026-02-19
UG_TRUE_1334,Amasasi ag’okumukumu gavuze e Kaliisizo – abasirikale abalwanyisa amagendo bwebabadde bakwata agambibwa okukusa engoye n’ebizigo,TRUE,CBS FM,traditional_media,Luganda,2026-02-19
UG_TRUE_1335,Ababalirizi b’ebitabo balabuddwa okukola emirimu gyabwe mu bwerufu baleme kufiiriza ggwanga,TRUE,CBS FM,traditional_media,Luganda,2026-02-19
UG_TRUE_1336,Abalimi e Bukomansimbi bawaanjagidde government okwongera amaanyi mu nkola y’okuyambako abalimi mu by’okufukirira ebirime okuyita mu nkola ya Micro Scale Irrigation,TRUE,CBS FM,traditional_media,Luganda,2026-02-19
UG_TRUE_1337,Omwoleso gwa CBS Pewosa gujjumbiddwa aboolesi n’abalambuzi,TRUE,CBS FM,traditional_media,Luganda,2026-02-19
UG_TRUE_1338,Katikkiro Mayiga mu butongole agguddewo omwoleso gwa CBS Pewosa e Masaka,TRUE,CBS FM,traditional_media,Luganda,2026-02-19
UG_TRUE_1339,Omwoleso gwa CBS Pewosa ogw’e Masaka ogwa 2025 gutandise ku ssaza e Masaka,TRUE,CBS FM,traditional_media,Luganda,2026-02-19
UG_TRUE_1340,Abakozi ba bank mu Uganda bagenda kumala ennaku 30 nga batambuza bigere okulwanyisa endwadde,TRUE,CBS FM,traditional_media,Luganda,2026-02-19
UG_TRUE_1341,President Museveni alabudde Abachina abalimira omuceere mu ntobazi za Uganda okuguvaako batandike okulima ogwoku lukalu – abadde aggulawo ekkolero ly’emmere y’ebyennyanja e Buikwe,TRUE,CBS FM,traditional_media,Luganda,2026-02-19
UG_TRUE_1342,Uganda Airlines efunye Bboodi empya eweereddwa ekisanja kya myaka 3,TRUE,CBS FM,traditional_media,Luganda,2026-02-19
UG_TRUE_1343,Omwoleso gwa CBS PEWOSA  e Masaka gwengedde – NARO ebangudde abakyala okwongera omutindo ku byebakola,TRUE,CBS FM,traditional_media,Luganda,2026-02-19
UG_TRUE_1344,Amaduuka agawerako gaggaddwa mu Kampala – waliwo abasuubuzi ababadde bakunga abalala okwekalakaasa bakwatiddwa,TRUE,CBS FM,traditional_media,Luganda,2026-02-19
UG_TRUE_1345,Abantu 8 bakwatiddwa ku bigambibwa nti baanyaga eyaliko omubaka wa parliament ya Nigeria ensimbi nga bamusuubizza okumuguza Zzaabu,TRUE,CBS FM,traditional_media,Luganda,2026-02-19
UG_TRUE_1346,Omubaka wa Bungereza mu Uganda Lisa Chesney asisinkanye akakiiko akakola ku bamusigansimbi – okutema empenda z’okusitula obusuubuzi mu Uganda,TRUE,CBS FM,traditional_media,Luganda,2026-02-19
UG_TRUE_1347,Police ekutte 3 abagambibwa okwekobaana nebabba amakolero,TRUE,CBS FM,traditional_media,Luganda,2026-02-19
UG_TRUE_1348,Government ereeta tteeka ku bakola mu bank – 385 batikkiddwa mu buweereza bwa bank obwenjawulo,TRUE,CBS FM,traditional_media,Luganda,2026-02-19
UG_TRUE_1349,Bank of Uganda ne ministry y’ebyensimbi zizizza buggya endagaano y’okukolera awamu emirimu gya government – mulimu n’okusasula ababanja,TRUE,CBS FM,traditional_media,Luganda,2026-02-19
UG_TRUE_1350,MTN ebangudde abawala abasoba mu mutwalo mu mirimu gy’okukanika nga bakozesa technology ow’omulembe,TRUE,CBS FM,traditional_media,Luganda,2026-02-19
UG_TRUE_1351,President Museveni amalirizza okulambula Kampala naasuubiza okwongeramu ensimbi eziweebwa buli muluka – eby’okuba ng’abasuubuzi basasula omusolo mungi abiwakanyizza,TRUE,CBS FM,traditional_media,Luganda,2026-02-19
UG_TRUE_1352,Government ya Uganda efulumizza trillion 17 okuddukanya emirimu gyayo mu kitundu ekisooka  eky’omwaka gw’ensimbi 2025/2026,TRUE,CBS FM,traditional_media,Luganda,2026-02-19
UG_TRUE_1353,President Museveni agguddewo mu butongole akatale k’e Busega – abaganyuddwa mu nkola ya PDM mu Kampala aboongedde ensimbi,TRUE,CBS FM,traditional_media,Luganda,2026-02-19
UG_TRUE_1354,Government ekomyawo engassi y’okunguudo  eya Express Penalty System,TRUE,CBS FM,traditional_media,Luganda,2026-02-19
UG_TRUE_1355,Abagoba ba Taxi e Bunnamwaya batabuse lwa byapa by’ettaka eryabasuubizibwa mu 2019 – tebabirabako,TRUE,CBS FM,traditional_media,Luganda,2026-02-19
UG_TRUE_1356,President Museveni atadde omukono ku mateeka 9 ng’omwaka gw’ebyensimbi 2025/2026 gutandika – agakwata kukusolooza omusolo gegasingako obungi,TRUE,CBS FM,traditional_media,Luganda,2026-02-19
UG_TRUE_1357,Ebbeeyi y’ensimbi esookerwako nga bweyimiridde – okuva mu bank of Uganda,TRUE,CBS FM,traditional_media,Luganda,2026-02-19
UG_TRUE_1358,Ababbi bayingiridde Finca bank e Nakasongola – bakuuliise n’obukadde bwa shs 192 ne computer,TRUE,CBS FM,traditional_media,Luganda,2026-02-19
