text,true_label,svm_pred,nb_pred,transformer_pred,svm_correct,nb_correct,transformer_correct
misleading viral video trump signing military orders unrelated nigeria,0,0,0,0,True,True,True
hoton da aka yada shafin x cewa kama mambobin ipob ko esn yi shi ne tun 2021,0,0,0,0,True,True,True
ennyonyi yeggye lya updf egudde mu somalia abantu 5 bafudde,1,1,1,1,True,True,True
abesimbyewo ku bwa president bwa uganda mu kalulu ka 2026 bakkiriziganyizza ku nteekateeka gyebalina okugoberera nga bakuba kakuyege wabwe,1,1,1,1,True,True,True
drbesigye azeemu okuzira emmere mu kkomera mukyala winnie byanyima agenze mu kooti eragire government emuyimbule,1,1,1,1,True,True,True
mcc drop 16 countries benefiting 2026 compact,0,0,0,0,True,True,True
kimenya mateeka okuwozesa abantu ba bulijjo mu kooti yamagye supreme court ya uganda eramudde,1,1,1,1,True,True,True
fake centenary banks head office kampala catch fire bank confirmed allegations fake,0,0,0,0,True,True,True
ababaka ba parliament 7 besozze nup nga wabulayo mbale okutuuka ku kalulu ka 2026,1,1,1,1,True,True,True
president museveni asonyiye ababadde bavunaanibwa ogwokubulankanya ensimbi ezaali ezokugulira ba ssentebe bebyalo eggaali,1,1,1,1,True,True,True
fake photo depict uda political rally mbeere north image taken mayuge district uganda,0,0,0,0,True,True,True
okukuza olunaku lwabakadde nga 01 october mu uganda bangi baasuulibwawo aboluganda lwabwe,1,1,1,1,True,True,True
facebook users take fake posts nigerias division dubawas factcheck,0,0,0,0,True,True,True
ugandas government invest new water supply systems improve access clean water,1,1,1,1,True,True,True
kaliddinaali robert francis prevost alondeddwa nga paapa leo xiv,1,1,1,1,True,True,True
abantu abatanamanyika muwendo bafiiridde mu muliro oguvudde ku mmotoka yamafuta e matugga,1,1,1,1,True,True,True
ebiti byabantu ebyenjawulo byongedde okuwaayo ensimbi okuyooyoota lutikko ye lubaga nabenzikiriza endala badduukiridde omulimu,1,1,1,1,True,True,True
education foundation unity progress mubaje tells muslims,1,1,0,1,True,False,True
bishop gaster nsereko atuuziddwa ngomulabirizi wa west buganda owomusanvu,1,1,1,1,True,True,True
omujaasi wa updf akubye mukyalawe amasasi agamuttiddewo,1,1,1,1,True,True,True
image apprehended terrorist linked taraba benue,0,0,0,0,True,True,True
cooking alcohol healthy,0,1,1,0,False,False,True
fake renovation siaka stevens stadium completed,0,0,0,0,True,True,True
recycled recent nigerian army photo controversy explained,0,0,0,0,True,True,True
captain denis olaa agattiddwa ku misango gyemmundu egivunaanibwa drbesigye ne obed kamulegeya,1,1,1,1,True,True,True
museveni hails tycoon nzeyis contribution ugandas economic transformation,1,1,1,1,True,True,True
bukomansimbi road crash leaves two dead three injured,1,0,0,0,False,False,False
x users video showing apprehended suicide bomber dates back 2020,0,0,0,0,True,True,True
guine des chiffres sur la rpartition ethnique en 2025 circulent sur facebook sans aucune base officielle,0,0,0,0,True,True,True
government kyaddaaki esazizaamu ebyapa byonna ebyekimpatiira ebyali byawebwa abantu ku ttaka lye kaazi liziddwayo bwakabaka bwa buganda,1,1,1,1,True,True,True
lgislatives 2025 ivoiriennes des propos du prsident de la commission lectorale indpendante modifis,0,0,0,0,True,True,True
fake video teso elders crying speaker anita among video individuals mourning death kenyas former prime minister raila odinga,0,0,0,0,True,True,True
bad bunny makes history trump criticises terrible super bowl show,1,0,0,0,False,False,False
yadda shafin facebook bayanan da ba daidai ba da gazawar dokoki ke jefa matan najeriya cikin sarkakiya sun je daukar ciki wa wadanda ba su iya dauka da kansu dan samun kudi,0,0,0,0,True,True,True
owemyaka 3 afiiridde mu muliro ogukutte ennyumba e kibiri busaabala,1,1,1,1,True,True,True
akabenje kagudde e namboole taxi etomereganye ne mmotoka ya buyonjo nekwata omuliro,1,1,1,1,True,True,True
abantu 2 bafiiriddewo mbulaga abalala baddusiddwa mu malwaliro emmotoka zitomereganye bwenyi ku bwenyi e bukomansimbi,1,1,1,1,True,True,True
hoax website promising free data celebrate whatsapps anniversary scam scam misleads users believing gifted 100gb free data whatsapps 16th anniversary,0,0,0,0,True,True,True
non aucun magistrat na retir des commissions rgionales lectorales bissauguinennes,0,0,0,0,True,True,True
fake campaign poster claiming businessman ham kiggundu vying kampala lord mayor fabricated nrm flagbearer position moses nsubuga,0,0,0,0,True,True,True
president museveni alonze omulamuzi aisha batala naluzze okufuuka kaliisoliiso wa government omuggya betty kamya tamwongedde kisanja,1,1,1,1,True,True,True
abantu 4 bafiiridde mu kabenje akagudde e kyazanga lukululana ebasaabadde,1,1,1,1,True,True,True
report groups posts promoting commercial surrogacy meta platforms,0,0,0,0,True,True,True
prof george wilson kanyeihamba aziikiddwa mu maka ge e buziga bamukubidde emiziinga 6,1,1,1,1,True,True,True
ugandas government invest new technology infrastructure support innovation research,1,1,1,1,True,True,True
roundup banditry claims topped dubawas verification last week,0,0,0,0,True,True,True
waziri wa afya atangaza kampeni ya chanjo ya sura ya matumbo kuanzia mwezi ujao,1,1,1,0,True,True,False
parliament esunsudde ssaabalamuzi omuggya flavian zeija,1,1,1,1,True,True,True
engdaniel ssebuggwawo bba wa minister owekjoyce ssebuggwawo aziikiddwa e nkumba ku lunaku lwennyini lweyazaalibwako,1,1,1,1,True,True,True
ronaldo hits 961st goal al nassrs 30 rout al kholood,1,0,0,1,False,False,True
bbaasi ebaddemu abasaabaze ewambiddwa abayeekera nebajiteekera omuliro ebadde eva south sudan ngeyingira uganda,1,1,1,1,True,True,True
government etangaazizza ku bya muzungu boda eyatikkiddwa ku nnyonyi nazzibwayo ewabwe,1,1,1,1,True,True,True
lections lgislatives en cte divoire un processus juridique et institutionnel en plusieurs tapes,0,0,0,0,True,True,True
ugandas government launch new programs promote cultural heritage tourism,1,1,1,1,True,True,True
ugandan opposition leader bobi wine didnt call international sanctions uganda,0,0,0,0,True,True,True
ssaabalabirizi kazimba mugalu alabudde government ya uganda ku bannauganda abagenze ku kyeyo,1,1,1,1,True,True,True
faux le page dattingu en cte divoire na pas incendi par des manifestants,0,0,0,0,True,True,True
emisinde gyamazaalibwa ga kabaka age 71 gitongozeddwa gyakubaawo nga 12 april2026,1,1,1,1,True,True,True
fake petroleum price increased boakais administration,0,0,0,0,True,True,True
makerere reinstates staff exposed bribery scandal,1,1,1,1,True,True,True
police ekyatubidde nobukadde bwa shs 50 ezaatekebwawo ku mawulire agakwata ku kuttibwa kwabafumbo ba mutaaga entebbe,1,1,1,1,True,True,True
frank nyakaana rusa alondeddwa nga ssenkulu wa kcca owekiseera,1,1,1,1,True,True,True
guine le prsident de transition mamadi doumbouya apprendraitil lire,0,0,0,0,True,True,True
msinformation relative aux rsultats de la prsidentielle ivoirienne 2025,0,0,0,0,True,True,True
amasasi nomukka ogubalagala bimyoose mu kuddamu okulonda kwabakulembeze ba nrm e iganga,1,1,1,1,True,True,True
court martial resumes sittings updf act overhaul,1,1,1,1,True,True,True
video gumi urging fg include bandits8217 welfare nigerias budget aigenerated,0,0,0,0,True,True,True
orbatheh travel usa viral photo manipulated,0,0,0,0,True,True,True
nigerias lower unemployment rate reflect government economic reforms,0,0,0,0,True,True,True
fake beetroot juice kill cancer cells 42 days,0,0,0,0,True,True,True
une image utilise pour faire croire limplication dun juge dans la campagne lectorale,0,0,0,0,True,True,True
parliament etandise okwekenneenya ennoongosereza mu mateeka agagenderera okugatta ebitongole bya government ebisiinga obungi bikwata ku bulimi na bulunzi,1,1,1,1,True,True,True
omubaka ssekikubo asimattuse amasasi e ssembabule omuwagizi attiddwa,1,1,1,1,True,True,True
uneb human resources director sabastian ngobi dies suddenly,1,1,1,1,True,True,True
fake viral video nuimi hakalang road gambia,0,0,0,0,True,True,True
une ancienne vido du ministre ivoirien de lenseignement suprieur manipule pour accrditer un financement de gros bras,0,0,0,0,True,True,True
ugandas health ministry discussing announcement third covid19 death facebook post fake,0,0,0,0,True,True,True
labarin kama fasto yana safarar makamai ga yan taadda jos tsohon labari ne,0,0,0,0,True,True,True
omuliro gusaanyizzaawo ekisulo kyabayizi e katabi,1,1,1,1,True,True,True
facebook video depict chaos zamfara,0,0,0,0,True,True,True
ugandas government implement new policies support smallholder farmers,1,1,1,1,True,True,True
controversy auditor general appointment trade minister matters arising,0,1,1,0,False,False,True
shin da gaske china ta gargadi mutanenta da su dena gineginen kamfanoni legas,0,0,0,0,True,True,True
images osimhen proposing regina aigenerated,0,0,0,0,True,True,True
fake trump ask elon musk leave united states,0,0,0,0,True,True,True
alwanye negwabadde ateebereza okuganza mukaziwe namutta police e mubende emunoonya,1,1,1,1,True,True,True
uganda host 2025 africa cup nations,1,1,1,1,True,True,True
ugandas central bank maintains interest rates support economic growth,1,1,1,1,True,True,True
ugandan police didnt tweet citizens must report anyone wearing masks,0,0,0,0,True,True,True
bishop samuel balagadde ssekadde kitalo 1944 2024,1,1,1,1,True,True,True
uganda police force recruiting polling constables 2026 election,0,1,0,0,False,True,True
abayizi bannauganda abasomera e iran bakomezeddwawo ku butaka ebikompola ebiva e israel ne america bikyesooza,1,1,1,1,True,True,True
uganda launches national climate resilience strategy safeguard vulnerable communities,1,1,1,1,True,True,True
fake icc issued arrest warrant president museveni son muhoozi icc told pesacheck email arrest warrants issued,0,0,0,0,True,True,True
dismisses trumps autism claims says backed science,0,0,0,0,True,True,True
abebyokwerinda bayiiriddwa okwetoloola kawempe north waliwo bannamawulire abakubiddwa,1,1,1,1,True,True,True
dp eyongezaayo okuwandiisa abagala okuvuganya ku bifo byobukulembeze abantu 207 bebaakewandiisa,1,1,1,1,True,True,True
shin da gaske ne wai ilimin boko kyauta ne makarantu mallakar gwamnati najeriya,0,0,0,0,True,True,True
five key takeaways dubawas report surrogacy nigeria,0,0,0,0,True,True,True
omumyuka womubaka wa president e budaka afiiridde mu kabenje e mayuge,1,1,1,1,True,True,True
non georges weah ne sest pas exprim contre un quatrime mandat dalassane ouattara,0,0,0,0,True,True,True
guine une image gnre par intelligence artificielle prsente comme un bourrage durnes par des militaires le jour du vote,0,0,0,0,True,True,True
government fail take action owo church massacre,0,1,1,0,False,False,True
eyaliko supreme mufti sheik suliman ndirangwa afudde,1,1,1,1,True,True,True
police etandise okunoonyereza ku ngeri abaagalana 2 bwebaagudde mu nnyanja nebafiiramu entebbe,1,1,1,1,True,True,True
cnn report pressure ugandan president museveni change name,0,0,0,0,True,True,True
misleading liberia anticorruption commission receive 1 million budgetary increment first time,0,0,0,0,True,True,True
fake incredible jj didn8217t meet davido viral photos doctored,0,0,0,0,True,True,True
police e mayuge ekutte abantu 6 abateeberezebwa okutta munnabwe olwenkaayana ezaavudde mu kulonda kwa nrm ku byalo,1,1,1,1,True,True,True
misleading mcc 2026 scorecard sierra leone worst ever,0,0,0,0,True,True,True
fake post nrm cec elections attributed rebecca kadaga parody account claim posted parody account impersonating former speaker parliament since deleted,0,0,0,0,True,True,True
third climate change awareness marathon launched parliament,1,1,1,1,True,True,True
omukozi wa radio akwatiddwa nemmundu enjingirire,1,1,1,1,True,True,True
bissau lassassinat de nino vieira et de tagme na wai ressurgit et nourrit des propos hostiles,0,0,0,0,True,True,True
ugandas government enhance cybersecurity measures protect citizens online,1,1,1,1,True,True,True
viral news article president bio endorsing fortuix agency hoax,0,0,0,0,True,True,True
parliament esunsudde abakulira judicial service commission abaggya,1,1,1,1,True,True,True
des avions de guerre sontils utiliss pour scuriser le scrutin rfrendaire en guine,0,0,0,0,True,True,True
ayaj jjr gbogbo oun ti ni lati nipa aisan yii,0,0,0,1,True,True,False
police efulumizza enteekateeka yokukuuma emirembe okwetegekera olunaku lwabajulizi e namugongo,1,1,1,1,True,True,True
government ya uganda ekoze ennoongosereza mu tteeka erifuga kooti yamagye yakuddamu okuwozesa abantu ba bulijjo,1,1,1,1,True,True,True
apps pimps algorithms technology advancing nigerias digital sex trade,0,0,1,0,True,False,True
oweknelson kawalya eyali omukubiriza wolukiiko lwa buganda afudde,1,1,1,1,True,True,True
shin da gaske ne putin yace najeriya ta yi watsi da taimakon da rasha ta ba wa kasar 1980,0,0,0,0,True,True,True
katikkiro awabudde government okuwandiika obupande bwokunguudo mu nnimi ennansi kyakuyambako okulwanyisa obubenje,1,1,1,1,True,True,True
abakyala abagenda okuweereza ku mpewo za cbs ku lunaku lwabakyala 2025,1,1,1,1,True,True,True
ugandas opposition unites demand electoral reforms ahead 2026 elections,1,0,0,1,False,False,True
cou establish industrial park produce affordable scholastic materials,1,1,0,1,True,False,True
ameefuga ga uganda age 62 okuddamu okwekenneenya nokunyweza ebiruubirirwa byaffe,1,1,1,1,True,True,True
misleading anambra lga ifeanyi chinweze disrupt election,0,0,0,0,True,True,True
claim 16000 people cancelled fifa world cup 26 tickets trump fake,0,0,0,0,True,True,True
international mens day celebrating men boys,0,1,0,0,False,True,True
uganda law society etaddewo ekibinja kya bannamateeka okwekenneenya emisango egivunaanibwa drkiiza besigye mu kooti yamagye,1,1,1,1,True,True,True
fake news rseaux sociaux et lections la guine face au dsordre informationnel,0,0,0,0,True,True,True
fake video doesnt show floating bags downtown kampala video aigenerated,0,0,0,0,True,True,True
ebola liberia,0,0,0,0,True,True,True
dubawa daidac launch project combat disinformation boost peacebuilding northern nigeria,0,0,0,0,True,True,True
le procureur de la rpublique de cte divoire vis par une dsinformation,0,0,0,0,True,True,True
abatuuze bazudde number plate za pikipiki eziwera ewasuuliddwa omulambo mu ndeeba,1,1,1,1,True,True,True
freennamdikanunow x video protesters kenya nigeria,0,0,0,0,True,True,True
okusaala eid elfitr 2025 omulangira nakibinge asabye abebyokwerinda beddeko ku kyokutulugunya bannansi,1,1,1,1,True,True,True
kooti eyisizza ekirago kyokuddamu okubala obululu bwekifo kyomubaka wa kalungu west joseph ssewungu gonzaga yeyabadde alaangiriddwa ku buwanguzi,1,1,1,1,True,True,True
trump write norway dissatisfaction nobel peace prize award snub,0,1,0,0,False,True,True
nup spokesperson waiswa mufumbiro released bail,0,1,0,0,False,True,True
scientific evidence onion juice cures conjunctivitis,0,0,0,0,True,True,True
president museveni atadde omukono ku mabago gamateeka 9 eryemmwanyi eriggyawo ucda likyajulidde,1,1,1,1,True,True,True
ugandas finance ministry giving free grants entrepreneurs farmers,0,1,0,1,False,True,False
nigeria know muslim christian population,0,0,0,0,True,True,True
prsidentielle du 25 octobre 2025 en cte divoire les grandes tapes du processus,0,0,0,0,True,True,True
non le budget de la primature du sngal na pas baiss de 213 millions d8217euros en 2025,0,0,0,0,True,True,True
la reconnaissance des langues nationales comme langues officielles ne rduit pas lanalphabtisme en guine,0,0,0,0,True,True,True
fake viral photo osimhen proposing regina daniels aigenerated,0,0,0,0,True,True,True
donald trump veut acheter le sngal,0,0,0,0,True,True,True
partly fake natasha museveni bank uganda governor position held michael atingiego natasha,0,0,0,0,True,True,True
fake daily monitor publish story ugandan activist sarah bireete publication disowned alleged article,0,0,0,0,True,True,True
government approved free electricity ugandans starting next month,0,1,0,1,False,True,False
akakiiko kebyokulonda katandise enteekateeka yokusiiga ekifaanyi kyakakonge kokulonda president 2026 bwekanaalabika,1,1,1,1,True,True,True
abazigu balumbye ebitebe bya police mu bitundu bye rwenzori waliwo abattiddwa,1,1,1,1,True,True,True
fausse information sur un suppos incendie dune rsidence du chef dtatmajor de larme de terre ivoirienne,0,0,0,0,True,True,True
police etandise okunoonyereza ku kigambibwa okuba bbomu ekubye amaka gomutuuze e kirinnya bweyogerere abantu 6 bafiiriddemu,1,1,1,1,True,True,True
nakayima asse 4 e mubende abalala 8 bapooca,1,1,1,1,True,True,True
profgrace lubaale alondeddwa ngomulabirizi omuggya owobulabirizi bwa busoga,1,1,1,1,True,True,True
ugandas agricultural exports increase significantly last fiscal year,1,1,1,1,True,True,True
kooti eragidde eyali minister agnes nandutu yennyonyoleko ku byokwekomya amabaati gabantu br kalamoja,1,1,1,1,True,True,True
museveni praises security forces unveils major infrastructure economic plans tarehe sita celebrations,1,1,1,1,True,True,True
une vido gnre par lintelligence artificielle tente de faire croire un coup dtat en cte divoire,0,0,0,0,True,True,True
amasannyalaze gakubye 5 e kansanga omu afiiriddewo,1,1,1,1,True,True,True
unhcr ekitongole ekikola ku nsonga zabanoonyi bobubudamu kisazeewo okusala ku bakozi bakyo mu uganda ensimbi ezibasasula tezirabika,1,1,1,1,True,True,True
abantu 2 bafiiridde mu muliro ogukutte ennyumba e kikaaya kawempe,1,1,1,1,True,True,True
motorists uganda tanzania crossing kenya cheaper fuel ignore fake graphic,0,0,0,0,True,True,True
research shows 1 8 students get adequate sleep,1,0,0,1,False,False,True
okukebera endagabutonde ku bantu abafiiriddwako abaabwe mu muliro ogwavudde ku mafuta e kigoogwa kuwedde,1,1,1,1,True,True,True
ugandas stateowned electricity distributor hiring,0,1,1,0,False,False,True
fake notice ministry agriculture promising grants fake maaif minister frank tumwebaze dismissed notice fake urged public ignore,0,0,0,0,True,True,True
nigerian lady fined collecting fare without showing laws position,0,0,0,0,True,True,True
omubaka wa butambala muwanga kivumbi akwatiddwa byekuusa ku busambattuko obwafiiramu abantu mu kulonda kwe butambala,1,1,1,1,True,True,True
faranah non quatre bureaux de vote nont pas ferms faute de matriel lectoral,0,0,0,0,True,True,True
clickbait headline suggests fifa banned south africa countries 2026 world cup,0,0,0,0,True,True,True
vat bank charges need know,0,0,0,0,True,True,True
abapolice 5 basuumusiddwa amaddaala okumyuka ssaabapolice wa uganda,1,1,1,1,True,True,True
video criminals breaking shop liberia,0,0,0,0,True,True,True
lgislatives marcory un candidat affirme que des citoyens utilisent des cartes dlecteurs appartenant dautres,0,0,0,0,True,True,True
second quarter inflation figure liberia stands 111 137,0,0,0,0,True,True,True
ettaka libumbulukuse mu district ye bulambuli neriziika amayumba 15 baziikuddwayo nga bafudde,1,1,1,1,True,True,True
akakiiko keddembe lyobuntu mu wakiso kalabudde ku mmere ekolebwa nga teriimu biriisa kawagidde ebbago lyetteeka lyemmere erireetebwa,1,1,1,1,True,True,True
old video police slapping arrestee recirculated social media,0,0,0,0,True,True,True
front page ugandan daily new vision calling president yoweri museveni worst dictator fake,0,0,0,0,True,True,True
court upholds mulirires disqualification budiope east mp race,1,1,1,0,True,True,False
abasirikale ba updf 13 bakwatiddwa mu bulumbaganyi obukoleddwa ku police ye wakiso,1,1,1,1,True,True,True
ebibiina byobufuzi bisisinkanye okusalawo ku biseera bya ipod ebijja,1,1,1,1,True,True,True
big interview resilience persistence propelled defeat basalirwa bugiri municipality race nrms oketcho,1,1,1,1,True,True,True
stanbic appoints joshua oigara ceo mweheire retires,1,0,0,1,False,False,True
abantu abasoba mu mitwalo 20000 bebalindiridde okuwanikibwa ku kalabba,1,1,1,1,True,True,True
government eyongedde okumyumyula etteeka erikwata kukubowa endagamuntu osobola okusibwa emyaka 3,1,1,1,1,True,True,True
video us president trump commenting electoral violence uganda doctored original video trumps speech campaign wisconsin 2016,0,0,0,0,True,True,True
drkiiza besigye asimbiddwa mu kooti yamagye agguddwako emisango 4 ne munne nebasindikibwa ku alimanda mu kkomera e luzira,1,1,1,1,True,True,True
omumyuka wa president majjesca alupo takyalina amuvuganya ku kifo kyomubaka wa parliament omukyala owa district ye katakwi,1,1,1,1,True,True,True
ekanisa ya stjohns kiwaatule ekutuddwa ku busumba bwe kira,1,1,1,1,True,True,True
omulamuzi dr flavian nzeija alayiziddwa ngomumyuka wa ssaabalamuzi wa uganda,1,1,1,1,True,True,True
viral video claiming bandits8217 invasion nigeria fake,0,0,0,0,True,True,True
une photo dun proche de laurent gbagbo manipule,0,0,0,0,True,True,True
top five tiktok claims factchecked 2025,0,0,0,0,True,True,True
applying castor oil sanitary pads cure fibroids,0,0,0,0,True,True,True
mwetondere bemusobezza mu nnaku zino eza ssekukkulu esembedde ssaabasumba augustine kasujja,1,1,1,1,True,True,True
viral tiktok videos promising users money aigenerated,0,0,0,0,True,True,True
katikkiro charles peter mayiga leero abakristo nabasiraamu batandise ekisiibo,1,1,1,1,True,True,True
abantu 5 bafiiridde mu kabenje akagudde e kagoma ku luguudo oluva e kawempe okudda e bombo 21,1,1,1,1,True,True,True
fake eps director sam gaye dismissed,0,0,0,0,True,True,True
cop30 highlights growing need countries resilience storms flood fires,1,0,0,1,False,False,True
affirmation sur des bulletins vierges yopougon aucune preuve existante la cei dment,0,0,0,0,True,True,True
government etongozza enguudo 2 ezitandise okukolebwa mu district ye wakiso,1,1,1,1,True,True,True
muwanga kivumbi omubaka butambala agguddwako omusango gwa butujju,1,1,1,1,True,True,True
breaking cid summons former kcca bosses kisaka luyimbazi,1,1,1,1,True,True,True
buikwe residents renew call museveni honour 1993 school pledge,1,1,1,1,True,True,True
abantu 2 bakubiddwa amasasi e kiwaatule,1,1,1,1,True,True,True
muntu promises tackle corruption restore trust politics,1,1,1,1,True,True,True
abantu 46 bafiiridde mu kabenje akagudde ku luguudo oluva e kampala okudda e gulu,1,1,1,1,True,True,True
dubawa wraps 2025 kwame karikari fellowship award ceremony,0,1,0,0,False,True,True
true soludo removes arabic texts naira notes cbn governor,0,0,0,0,True,True,True
claim ratio one doctor 5000 misleading,0,0,0,0,True,True,True
plusieurs vidos sorties de leurs contextes pour faire croire des manifestations lors de la prsidentielle en guine,0,0,0,0,True,True,True
nrms oketcho wins bugiri municipality byelection defeating basalirwa,1,1,1,1,True,True,True
fake news sur la tenue de llection prsidentielle en cte divoire,0,0,0,0,True,True,True
fake speaker anita among critical condition following accident speaker publicly campaigning continues performing official duties,0,0,0,0,True,True,True
fake ugandan opposition leader bobi wine fled us evidence support claim bobi wine made public statements indicating left uganda,0,0,0,0,True,True,True
president museveni atongozza enteekateeka yokutandika okuzimba bunyoro university yakusomesa masomo ga science ne technology,1,1,1,1,True,True,True
bnin le recrutement de 89 686 agents lectoraux par la cena faitil chuter le taux de chmage 0,0,0,0,0,True,True,True
sahara reporters claim wike boycotted council state meeting fake,0,0,0,0,True,True,True
guinebissau une infographie non fiable annonce la victoire dumaro sissoco embal,0,0,0,0,True,True,True
front page claiming 203 killed ugandan riots fake says newspaper new vision,0,0,0,0,True,True,True
raila omoro odinga afiiridde ku myaka 80 government ya kenya erangiridde wiiki namba eyokumukungubagira,1,1,1,1,True,True,True
mathias mpuuga atongozza ekibiina ekiggya ki democratic front akabonero muti,1,1,1,1,True,True,True
police suspect ucu deans murder former househelp,1,1,0,1,True,False,True
nixon agasirwe asindikiddwa ku alimanda ku misango gyokutemula eyali omuwaabi wemisango gya government omugenzi joan kagezi,1,1,1,1,True,True,True
ssenkulu wa kcca omuggya frank nyakaana alambise byatandikirako okukola essira alitadde ku kukulwanyisa nguzi,1,1,1,1,True,True,True
would adding lemon sugar sanitary pads prevent infection,0,0,0,0,True,True,True
sperm quality affects fertility miscarriage risk womens appearance pregnancy,0,1,1,0,False,False,True
image ugandan soldiers slaughtering locusts,0,0,0,0,True,True,True
akakiiko kebyokulonda katuusizza obuuma obulala emitwalo 49000 obugenda okukozesebwa mu kulonda kwa 2026 ssentebe waako simon byabakama asuubizza bannauganda akalulu akamazima nobwenkanya,1,1,1,1,True,True,True
president museveni yekokkodde ekibba ttaka mu ggwanga government ereeta etteeka eppya ku ttaka,1,1,1,1,True,True,True
kampala clean without killing livelihoods,1,0,0,1,False,False,True
onesmas twinamasiko avuganya ku kyomubaka wa parliament agambibwa okukuba ekikonde ssaabaminister robinah nabbanja asiindikiddwa ku alimanda,1,1,1,1,True,True,True
missing context video show eddie mutwe bobi wines bodyguard released prison 2025 claim video eddie mutwe released prison 2021,0,0,0,0,True,True,True
la rsidence de lambassadrice du liban en cte divoire na pas incendie,0,0,0,0,True,True,True
uganda loses 14bn annually illegal activities fish sector,1,1,1,1,True,True,True
paapa francis wakuziikibwa nga 26 april2025 okukungubaga okutongole kwakumala ennaku 9,1,1,1,1,True,True,True
bidiyon fulani na wasa da wani makamin da amurka ta harbo jihar sokoto ne,0,0,0,0,True,True,True
lagdo dam users delete facebook posts dubawa8217s factcheck,0,0,0,0,True,True,True
altered video uk prime minister keir starmer announcing jobs free immigration programme doctored video edited using ai,0,0,0,0,True,True,True
x users video tinubu dismissing trumps threat aigenerated,0,0,0,0,True,True,True
omumyuka womulabirizi wobulabirizi bwa kampala atuuziddwa nokutongoza lutikko empya president museveni awaddeyo obukadde bwa shs 100,1,1,1,1,True,True,True
